Kalimat Augmentasi,Kalimat Asli,Model,Instruksi,Instruksi Lengkap,Sesuai Instruksi,Koheren,Kohesi,Natural,Bahasa,Label
"Ngatur harga beras wae ora iso, kok isih ngaku penguasa, cok jancok. Ojo sok presiden, munduro saiki, dasar ra nduwe isin, raimu cok.",USER Menyetabilkan harga beras aja gak becus kok jadi penguasa cok jancok.munduro cok kamu jadi presiden dasar gak punya malu raimu cok,GPT,Paraphrasing,Kalimat-kalimat berikut ini dihasilkan menggunakan teknik parafrase.,,,,,Jawa,Hate
"Ngatur harga beras wae ora iso kok malah dadi pemimpin cok jancok, mundur wae cok dadi presiden ora nduwe isin raimu cok",USER Menyetabilkan harga beras aja gak becus kok jadi penguasa cok jancok.munduro cok kamu jadi presiden dasar gak punya malu raimu cok,Claude,Paraphrasing,Kalimat-kalimat berikut ini dihasilkan menggunakan teknik parafrase.,,,,,Jawa,Hate
"USER Ngurusi rego beras wae ora iso, kok malah dadi penguasa cok. Minggato cok, dhasar rai gedek, dadi presiden ora isin.",USER Menyetabilkan harga beras aja gak becus kok jadi penguasa cok jancok.munduro cok kamu jadi presiden dasar gak punya malu raimu cok,Gemini,Paraphrasing,Kalimat-kalimat berikut ini dihasilkan menggunakan teknik parafrase.,,,,,Jawa,Hate
"Ngurus jadwal kereta wae gak becus, kok ngaku pemimpin kota, cok jancok; munduro wae, raimu ora nduwe isin, cok.","USER Menyetabilkan harga beras aja gak becus kok jadi penguasa cok jancok.munduro cok kamu jadi presiden dasar gak punya malu raimu cok","GPT","Aggressive Transformation","Kalimat-kalimat berikut ini dihasilkan dengan mengubah topik dan konteks pembicaraan dari kalimat asli secara signifikan, tetapi tetap mempertahankan tingkat kekasaran (jika termasuk hate speech) atau kehalusan (jika bukan hate speech).",,,,,"Jawa","Hate"
"Ngatur traffic macet wae ora iso kok dadi walikota cok jancok, turun wae cok saking jabatanmu dasar gak nduwe wirang raimu cok","USER Menyetabilkan harga beras aja gak becus kok jadi penguasa cok jancok.munduro cok kamu jadi presiden dasar gak punya malu raimu cok","Claude","Aggressive Transformation","Kalimat-kalimat berikut ini dihasilkan dengan mengubah topik dan konteks pembicaraan dari kalimat asli secara signifikan, tetapi tetap mempertahankan tingkat kekasaran (jika termasuk hate speech) atau kehalusan (jika bukan hate speech).",,,,,"Jawa","Hate"
"Main game aja gak becus kok sok jago cok jancok. Pensiun wae cok kamu jadi pro player dasar gak punya skill raimu cok.","USER Menyetabilkan harga beras aja gak becus kok jadi penguasa cok jancok.munduro cok kamu jadi presiden dasar gak punya malu raimu cok","Gemini","Aggressive Transformation","Kalimat-kalimat berikut ini dihasilkan dengan mengubah topik dan konteks pembicaraan dari kalimat asli secara signifikan, tetapi tetap mempertahankan tingkat kekasaran (jika termasuk hate speech) atau kehalusan (jika bukan hate speech).",,,,,"Jawa","Hate"

